,title,link,date,body,source,author
0,¿La llegada de Joseph Biden a la Casa Blanca es buena o mala noticia para México y América Latina?,https://actualidad.rt.com/opinion/john-ackerman/377894-biden-llega-mantener-statu-quo,23-12-2020,"Pocos extrañarán a Donald Trump, pero hay bastantes motivos para preocuparnos con respecto a las políticas de Biden hacia la región.


Así que cuidado, ¡eh! No es hora de echar las campanas al vuelo, sino para vigilar y observar.


Los nombramientos de Joseph Biden son diversos racialmente y hay una loable presencia de mujeres, pero, ideológicamente, el escenario es totalmente monocromático.


Escondiendo atrás del arcoíris publicitario hay una escalofriante uniformidad de enfoques.


El 80 % de los nombramientos de Biden trabajaron con Barack Obama y son casi inexistentes las voces que claman por una transformación profunda de la República.


Tom Vilsack fue secretario de Agricultura durante los ocho años de Obama y ahora volverá a ocupar exactamente el mismo cargo.


Vivek Murthy fue el cirujano general de Obama y también lo será con Biden.


El 'Chief of Staff' de Biden, Ron Klain, fue 'Chief of Staff' de Biden durante la Presidencia de Obama. El nuevo secretario de Estado o canciller era el subsecretario de Estado durante el Gobierno de Obama. Y el nuevo secretario de Seguridad de la Patria, Alejandro Mayorkas, fue también subsecretario en la misma institución con Obama.


¡Y así podríamos seguir hasta el cansancio!


En lugar de responder al trumpismo con una atrevida apuesta a favor de una sociedad de derechos y justicia, más igualitaria y participativa, Biden parece estar convencido de que fue electo para, simplemente, retornar al viejo 'statu quo'.


¡Al mismo 'statu quo' que generó las condiciones para el surgimiento y la victoria de Donald Trump en 2016!


La época de Obama fue un desastre.


El primer presidente afroamericano de EE.UU. jamás cumplió con su promesa de sacudir la estructura social y generar nuevas oportunidades para las minorías, los pobres y los migrantes.


Al contrario, Obama es recordado como el 'deportador en jefe' por las millones de deportaciones que impulsó durante sus ocho años en la Casa Blanca y su iniciativa a favor de los 'dreamers' fue siempre parcial.


Fue, precisamente, por la falta de compromiso real del expresidente con la población de jóvenes migrantes que se quedaron en la zozobra y la incertidumbre durante toda la gestión de Trump.


Con respecto a la política exterior, Obama fue capturado por el Pentágono desde el primer día. Sus acuerdos históricos con Irán y Cuba, así como el impulso al Acuerdo de París a favor del medio ambiente fueron importantes.


Pero, en general, Obama no alteró la vieja tradición de violento intervencionismo estadounidense en el mundo: en Afganistán, en Yemen, en Israel y en América Latina.


El aval al golpe de Estado en Honduras en 2009 y la declaración de Venezuela como ""amenaza a la seguridad nacional"" de EE.UU. en 2015 constituyen solo dos ejemplos de su falta de respeto hacia la región.


En México, Obama trabajó encantado con los gobiernos asesinos y corruptos de Calderón y Peña Nieto. No fue ninguna coincidencia que Calderón haya sido uno de los primeros líderes mexicanos en celebrar a Biden, mucho antes de que su victoria fuera reconocida formalmente.


Recordemos que EE.UU. se construyó con base en la casi total aniquilación de sus pueblos indígenas y en la esclavitud de más de cuatro millones de africanos y sus descendientes.


Su caduco sistema legal e institucional data del siglo XVIII y está diseñado para favorecer siempre al interés privado por encima del público. Se gastaron 4.000 millones de dólares, equivalente a 80.000 millones de pesos mexicanos, en la elección presidencial de 2020.


Fue la elección presidencial más cara en la historia de la humanidad.5,2 millones de ciudadanos estadounidenses no pudieron votar por haber sido condenados por algún delito en el pasado.


Un gran porcentaje de estos ciudadanos privados de sus derechos son de comunidades raciales minoritarias.


Hay también millones de mexicanos y latinoamericanos que viven y trabajan en EE.UU. que no pudieron votar porque jamás se registraron o porque no cuentan con la documentación requerida.


Es un error, entonces, echarle la culpa a Trump por la crisis actual del sistema político estadounidense. El magnate neoyorquino no hace otra cosa que aprovechar las enormes fisuras estructurales que afectan a aquella nación.


Y la verdadera esperanza no es Biden, desde luego, sino el movimiento Black Lives Matter y agrupaciones afines que luchan todos los días por un verdadero 'cambio de régimen', de manera similar a los movimientos progresistas de América Latina.


Una vez más, el norte tiene mucho que aprender del sur.",RT,John Ackerman
1,"La oposición en México, con aires golpistas, quiere 'frenar' a AMLO",https://actualidad.rt.com/opinion/john-ackerman/370274-oposicion-mexico-aires-golpistas-amlo,18-10-2020,"Fracasaron los golpistas.


Quisieron utilizar la pandemia para tumbar a Andrés Manuel López Obrador, pero les salió el tiro por la culata. La enorme popularidad del presidente se mantiene firme, su poder se consolida hoy más que nunca y, mientras, las tiendas de campaña de Frenaaa vuelan como papalotes.


Ningún líder político mundial ha salido ileso de esta terrible pandemia. Algunos incluso se han enfermado directamente del virus, como Donald Trump, Boris Johnson y Jair Bolsonaro. En el mundo ya hay casi 40 millones de personas infectadas y más de un millón de muertos. Se estima que la economía global perderá un 5 % de su valor en 2020.


En América Latina, la situación ha sido particularmente preocupante: 10 millones se han enfermado y 150.000 han muerto. La Cepal anticipa un decrecimiento del 9,1 % en la región para 2020 y México no es excepción a esta regla. Tenemos ya más de 80.000 muy lamentables muertos, la economía ha sufrido duramente, con la pérdida de más de un millón de empleos y se estima una contracción del PIB del 10 % para 2020.


La oposición golpista ha querido utilizar esta crisis sanitaria y económica para atacar y deslegitimar a López Obrador. Se ha lanzado con todo. Un grupo de exsecretarios de salud del viejo régimen anunciaron que ellos podrían haber resuelto fácilmente, en un par de meses, el problema de la pandemia.


El grupo Frenaaa ha organizado marchas constantes en contra del presidente y hoy ocupa el Zócalo con tiendas de campaña: algunas habitadas y muchas, simplemente, vacías.


El líder de Frenaaa, Gilberto Lozano, ha sido perfectamente claro con respecto a su estrategia. Buscan seguir explícitamente el ejemplo del golpe de Estado en contra de Evo Morales, de acuerdo con el guión de golpe blando redactado por Gene Sharp.


Los oligarcas Claudio X. González y Gustavo de Hoyos han lanzado una Frenaaa 2, la iniciativa Sí por México: más perfumada que la de Lozano, pero con exactamente el mismo objetivo. Y el escritor Martín Moreno de plano ha hecho un llamado a quemar militantes de izquierda, como si estuviéramos en la época de la Inquisición.


Mientras, cada día se fortalece más el liderazgo de López Obrador. La tasa de aprobación para el presidente se mantiene en un firme 60 % de la población, con muy poca variación desde que ganó las elecciones hace dos años. El nivel de opiniones favorables para López Obrador se encuentra mucho más arriba de otros líderes mundiales, como Angela Merkel, Justin Trudeau, Jair Bolsonaro o Donald Trump.


México cada vez se afianza más como un líder mundial en materia política. Y no solamente hay transformaciones en el Poder Ejecutivo, también en las otras instituciones del Estado mexicano. La Suprema Corte ha aprobado la realización de una consulta popular sobre los crímenes y la corrupción de los expresidentes.


El Instituto Nacional Electoral rechazó el registro del partido del expresidente Felipe Calderón y Margarita Zavala. Y la Cámara de Diputados ha aprobado la eliminación de los fideicomisos en toda la Administración pública federal.


Estas transformaciones no implican la subordinación de otros poderes a la voluntad del presidente o la llegada de un dictador, como denuncian medios mal informados como el Financial Times e intelectuales como Héctor Aguilar Camín, Denise Dresser y Jorge Castañeda.


Con el paso del tiempo, el liderazgo de López Obrador está generando un nuevo contexto político, más democrático y con más oxígeno ciudadano, que permite que las instituciones públicas vayan fortaleciendo su autonomía respectiva y desarrollando 'anticuerpos' frente a los poderes fácticos y las redes de complicidad del viejo régimen.


La subordinación de otros poderes al presidente fue la realidad del pasado. Hoy, tenemos la construcción colectiva de un nuevo compromiso con el interés público de parte del Estado mexicano en su conjunto.


¿O qué opinas tú? ¿México va a la deriva bajo el liderazgo de ""un dictador populista"" o empieza a abrir nuevos horizontes de esperanza?


Compártenos tus opiniones aquí, en las redes sociales. El debate y la discusión auténticas nos harán libres.",RT,John Ackerman
2,Las confesiones de Emilio Lozoya confirman una presidencia comprada,https://actualidad.rt.com/opinion/john-ackerman/365051-confesiones-emilio-lozoya-confirman-presidencia-comprada,31-08-2020,"Enrique Peña Nieto fue un presidente espurio.


Las confesiones de Emilio Lozoya confirman lo que todos sospechábamos en aquel momento: la elección presidencial de 2012 fue un fraude, donde la silla presidencial se compró con cañonazos de millones de dólares proporcionados por la empresa Odebrecht y otras fuentes oscuras.


El coordinador internacional de la campaña de Peña Nieto, Emilio Lozoya, ha proporcionado información precisa sobre el origen y el destino de sobornos por la cantidad de 1.000 millones de pesos durante la campaña de 2012.


Ahí están los lugares y los tiempos, los nombres y los apellidos. Pero esto es apenas la punta del iceberg.


La Comisión de Investigación Monex de la Cámara de Diputados demostró en su momento que Peña Nieto había rebasado el tope de gastos de campaña por 14 veces.


El tope fue de 336 millones de pesos, pero el candidato del PRI habría gastado por lo menos 4.263 millones.


Este monto no solamente sería de las famosas tarjetas Monex, sino también para las tarjetas de la tienda Soriana que, de acuerdo con la comisión investigadora, dispersaron por lo menos 2.294 millones de pesos durante el proceso electoral.


Todos recordamos las escalofriantes escenas de las compras de pánico que vaciaron los anaqueles de las tiendas Soriana en todo el país después de las elecciones presidenciales.


Los votantes acudieron en masa a cobrar sus tarjetas frente a los rumores de que los saldos que los operadores priistas les habían entregado a cambio de sus votos se desaparecerían después de la celebración de los comicios.


Recientemente, el Instituto Nacional Electoral descubrió una nueva empresa que también participó de manera ilegal en la triangulación de fondos hacia la campaña de Peña Nieto: Logística Estratégica Asismex.


Esta empresa manejó libremente la friolera de 1.400 millones de pesos durante aquel proceso electoral sin reportar un solo peso ni a la autoridad electoral ni a las autoridades hacendarias.


Y la periodista Carmen Aristegui ha develado una importante punta de la madeja con respecto al origen del dinero de las tarjetas Monex. Una investigación de su equipo demostró que por lo menos una parte del financiamiento provino de la empresa Grupo Comercializador Cónclave, operada por Rodolfo David Dávila Córdoba, 'El Cónsul', alguien identificado por las autoridades como operador financiero del Cártel de Juárez. En general, la campaña de Peña Nieto utilizó un mecanismo de triangulación de recursos típico de operaciones de lavado de dinero.


En el caso de las tarjetas Monex, por ejemplo, su contratación no fue realizada directamente, sino por medio de la empresa Alkino Servicios y Calidad que, a su vez, contrató a la empresa Comercializadora Atama que, por su parte, delegó diversas operaciones a las empresas Inizzio y Efra.


Quien cuenta con toda la información sobre los flujos financieros de 2012 es José Antonio Meade, secretario de Hacienda de Felipe Calderón durante todo el proceso electoral de 2012 y, después, premiado por su silencio y complicidad con el cargo de secretario de Relaciones Exteriores al inicio del Gobierno de Peña Nieto.


Ahora bien, frente a la bomba que implican las confesiones de Lozoya, entró en acción un desesperado operativo de control de daños de parte de los voceros del viejo régimen.


De la nada, aparecieron milagrosamente dos videos de hace cinco años donde aparece un señor llamado David León entregando bolsas de papel a Pío López Obrador, hermano de Andrés Manuel, supuestamente con dinero ""para el movimiento"". Esta revelación fue divulgada a los cuatro vientos por la mayor parte de los medios comerciales, en un evidente esfuerzo por tender una cortina de humo sobre el caso Lozoya e insinuar que ""todos son iguales"".


Pero los videos no demuestran la comisión de delito alguno.


Se debe investigar, desde luego, el origen y el destino de estos recursos, pero no hay nada en la ley que prohíba la realización de donativos para apoyar solidariamente a un movimiento social. No existe comparación alguna entre un acto de apoyo solidario y la probable comisión de delitos graves de lavado de dinero, extorsión y compra y coacción del voto denunciadas por Lozoya.


Cómo recuerdo las burlas desde las cúpulas del poder cuando denunciamos el fraude de 2012. Tengo muy claro los insultos que nos lanzaban a los millones de personas que salimos a las calles para apoyar a los jóvenes de #YoSoy132 en su exigencia por democratizar los medios y frenar la imposición de Peña Nieto.


Muchos fuimos censurados y marginados y otros reprimidos y encarcelados durante el sexenio pasado, precisamente por resistir a un Gobierno despótico que había comprado la presidencia y se aprestaba a vender el país.


Pero hoy la verdad nos ha hecho justicia.


Quienes antes se reían cínicamente, hoy tendrán que enfrentar la justicia.",RT,John Ackerman
3,La crisis sanitaria en México ha traído olas de desinformación,https://actualidad.rt.com/opinion/john-ackerman/349265-crisis-sanitaria-mexico-olas-desinformacion,08-04-2020,"En México, ¡ni la crisis sanitaria logra frenar a los golpistas! En lugar de apostarle a la unión para juntos derrotar a la pandemia, un sector de la oposición más bien ve esta situación como la perfecta oportunidad para tumbar al presidente Andrés Manuel López Obrador.


¿Es cinismo? ¿Mezquindad? ¿O simple miopía?


La curva de crecimiento del coronavirus en México es mucho menor que en otros países como Italia, España o EE.UU., donde la situación ya está francamente fuera de control.


Ello se debe a que el Gobierno mexicano ha seguido fielmente las recomendaciones de los expertos y de la OMS. Por ejemplo, mientras Italia y España esperaron para cerrar las escuelas y cancelar los eventos públicos hasta que tuvieran 2.000 y 1.000 casos, respectivamente, en México se actuó a partir de los 100 casos.


Después, a partir de la entrada de la Fase 2 el pasado 24 de marzo se difundió masivamente la campaña nacional de 'Susana Distancia' y se establecieron mecanismos para el trabajo desde la casa en los sectores público y privado.


Posteriormente, el jueves 26 de marzo el Gobierno Federal Suspendió todas sus actividades no esenciales en el país.


Todo ello logró una reducción del 60 % en la movilidad. Aun así, el lunes, 31 de marzo el Consejo de Salubridad General fue un paso más allá y, sin esperar hasta entrar oficialmente a la Fase 3, adelantó la declaratoria formal de emergencia sanitaria nacional.


Durante todo el mes de abril el sector privado debería suspender sus actividades no esenciales y también garantizar sus salarios a sus trabajadores. El Gobierno también ha adelantado el pago de las pensiones a adultos mayores y becas para estudiantes y otras poblaciones vulnerables. Y se está reconvirtieron todo el sistema nacional de salud, incluyendo hospitales públicos, privados y militares, para atender a pacientes con covid-19.


También se están haciendo las compras del equipamiento médico necesario para hacer frente al virus e invirtiendo recursos especiales en la investigación científica.


Es imposible evitar totalmente los contagios, pero el Gobierno ha actuado a tiempo, con enorme responsabilidad y siguiendo las recomendaciones de los científicos.


Pero todo ello no satisface a la oposición golpista. De manera perversa, se emocionan con cada muerto y se regocijan con la crisis sanitaria. La ven como su tabla de salvación, su gran oportunidad para, finalmente, deshacerse de un presidente que, desde el primer día ha favorecido y privilegiado a los pobres.


México hoy vive una verdadera pandemia de información falsa y provocaciones mediáticas que obstaculizan las labores de las autoridades.


La oposición ha dado por muertas de manera errónea a importantes figuras públicas.


Ha sembrado supuestas dudas sobre la veracidad de los datos proporcionados por las autoridades.


Y se ha burlado de la cercanía de Andrés Manuel López Obrador con el pueblo en estos momentos difíciles.


Han llegado incluso al ridículo extremo de llamar ""pederasta"" a López Obrador por haber besado en el cachete a una niña durante una gira reciente… mucho antes de la entrada a la Fase 2, por cierto.


Eso sí, López Obrador sigue cercano al pueblo, trabajando, supervisando obras, animando a la población y otorgando su tradicional conferencia de prensa 'mañanera'.


El presidente dice que actuar de otra manera sería dejar ""un vacío de poder"" que podría ser aprovechado por los golpistas para retornar al viejo régimen.


La mayoría de los líderes del mundo han tomado otra ruta. 


Con el fin, precisamente, de evitar algún vacío de poder, cierran fronteras, aumentan la vigilancia a sus ciudadanos, declaran toques de queda, cancelan elecciones y sacan los militares a las calles.


O, por lo menos, así ha ocurrido en Bolivia, Chile, EE.UU., Turquía, China, España, Argentina, Singapur y muchos otros países. Muchos incluso preguntan si esta crisis marcaría la llegada de un nuevo estado de excepción permanente para todos y todas en el mundo. Pero en México las cosas son diferentes.


Durante el último siglo, Mientras la mayoría de los otros países de América Latina sufrían violentos golpes de Estado y gobiernos militares, México siempre ha sido la excepción, con la continuidad de un gobierno civil desde 1934.


Y, a tono con esta larga tradición libertaria, López Obrador se niega a esconderse atrás de cuatro paredes o recurrir a la fuerza, sino que busca mantenerse presente y a cargo de la nación por la vía democrática, aunque ello ponga en riesgo su vida y también pueda ser considerado ""un mal ejemplo"" para la población, que debe estar resguardada en sus casas hasta que pase la tormenta.


¿Hace bien López Obrador? ¿Qué opinas tú?",RT,John Ackerman
4,La Cuarta Transformación será feminista o no será,https://actualidad.rt.com/opinion/john-ackerman/344451-cuarta-transformacion-sera-feminista,28-02-2020,"Es inaceptable el uso político de la digna causa feminista tanto por la derecha conservadora como por las ultras ""separatistas"". Para poder vencer al patriarcado tenemos que trabajar juntos, mujeres y hombres, por una profunda transformación social anti-neoliberal.


¡Vaya, vaya! ¡La derecha de repente se volvió feminista! Felipe Calderón, Margarita Zavala, Javier Lozano, Fernando Belaunzarán y otros personajes de la misma estatura moral, ahora se indignan por los feminicidios y acusan al gobierno de López Obrador de supuestamente no preocuparse por las mujeres.


Los sectores más misóginos de la sociedad y los políticos responsables por el desbordamiento de la violencia a partir de 2006, ahora señalan con su dedo flamígero al gobierno actual como si fuera responsable por las inaceptables agresiones en contra de las mujeres.


Recordemos que el combate al patriarcado y al neoliberalismo van de la mano. Los supuestos feministas de derecha no defienden en realidad a las mujeres sino que solo quieren usar esta digna causa para atacar a un gobierno de izquierda que afecta sus intereses de clase.


No podemos permitir que la derecha conservadora se apropie de esta digna causa con su convocatoria para un supuesto ""Día Sin Mujeres"" el 9 de marzo. El Día Internacional de las Mujeres es el 8 de marzo y hay que celebrarlo ese día saliendo a protestar a las calles, no escondiéndose en la casa el día 9.


La lucha feminista será anti-neoliberal, o no será. Y hay que aprovechar este importante momento feminista para avanzar en una agenda de políticas públicas a favor de las mujeres.


Legalicemos la interrupción del embarazo al nivel nacional desde la misma Constitución.


Avalemos también a los matrimonios del mismo sexo en toda la República.


Establezcamos fiscalías especializadas en feminicidios en todas las entidades federativas del país.


Y construyamos guarderías en cada rincón de la patria para que cualquier mujer que quiera trabajar pueda hacerlo sabiendo que sus hijos serán bien atendidos.


Todo ello se debe hacer de la mano con el nuevo gobierno, un gobierno feminista encabezado por un gabinete paritario y que ha demostrado su firme compromiso con la causa de las mujeres.


La Cuarta Transformación será feminista, o no será.


¡Pero espérate un momento! ¡Los hombres no tenemos el derecho a opinar sobre estos asuntos! O por lo menos así lo considera un sector específico del movimiento feminista:


Dicen las pintas de las mujeres ""separatistas"" de la Facultad de Filosofía y Letras de la UNAM. Entiendo, claro, es difícil que los hombres, como beneficiarios del sistema patriarcal, realmente entiendan el sufrimiento y la injusticia de las mujeres Tenemos que ser muy respetuosos y seguir la pauta marcada por las mujeres.


¿Pero en realidad creen que no podemos formar parte de la solución?


¿No es importante que los hombres se sensibilicen, sean autocríticos y participen activamente en destruir al ""macho interior"" que todos tenemos dentro?


¿O qué opinas tú?",RT,John Ackerman
