,title,link,date,body,source,author
84,"Ya casi se acaba esta pesadilla. ¡Adiós, Mister Peña!",https://actualidad.rt.com/opinion/john-ackerman/248423-acaba-pesadilla-adios-mister-pena,29-08-2017,"Peña Nieto será recordado como uno de los peores presidentes de México.


La lista de agravios es interminable:


La privatización de PEMEX.


El abyecto servilismo a Donald Trump.


El aumento de la violencia y la delincuencia.


La corrupción sin control.


Los constantes fraudes electorales.


El ataque a los maestros y a los derechos laborales en todo el país.


El estancamiento de la economía y el aumento de la pobreza


La represión en contra de los activistas, los jóvenes y los periodistas.


La impunidad para los corruptos y los violadores de derechos humanos. 


Cuando empezó su sexenio, Peña Nieto quiso ser tan temido como Porfirio Díaz, pero al final de cuentas ni siquiera llegó a ese nivel. Resultó ser una vil copia de Victoriano Huerta, el asesino de Francisco I. Madero. O de Santa Anna, quien entregó la mitad del territorio nacional a los Estados Unidos.


Para este Quinto Informe de Gobierno, con un gasto millonario y el apoyo de todos los canales de televisión y de radio, Peña utiliza sus últimos momentos de poder para crear la imagen falsa de ser un hombre de Estado que se preocupa por los mexicanos. 


Mientras, los integrantes de su círculo más cercano, Luis Videgaray y José Antonio Meade, mandan a hacer costosos óleos para colgar en Palacio Nacional y así 'inmortalizar' su ineptitud.


La buena noticia es que el Quinto Informe de Gobierno siempre marca el ocaso del poder del presidente en funciones. 


Inicia la carrera presidencial y el próximo año, alguien más tomará las riendas en México. 


¿Cómo visualizas tú el nuevo Gobierno? ¿Qué harás tú para lograrlo?


 ",RT,John Ackerman
85,¡Cuidado con los terroristas en México!,https://actualidad.rt.com/opinion/john-ackerman/247810-cuidado-terroristas-mexico-barcelona,22-08-2017,"Toda nuestra solidaridad desde México con los dignos catalanes que, estoy seguro, sabrán responder con entereza al reciente ataque en Las Ramblas. La única forma para acabar con el terrorismo es cada vez con más paz, democracia y derechos. 


En México también conocemos la utilización de la violencia con fines políticos. De manera sistemática estamos expuestos a acciones cuyo único propósito es sembrar el miedo y el pánico entre la población.


Apenas hace un par de meses, en la víspera de las elecciones para el gobernador del Estado de México, alguien colocó cabezas de puerco y cruces ensangrentadas en la puerta de varias oficinas del partido Morena. Esa noche muchos militantes de Morena también recibieron amenazas de muerte vía telefónica. Y el día de la elección hubo secuestros, allanamientos y citatorios falsos con el fin de desalentar la participación ciudadana.


Hace poco más de un año, el 19 de junio de 2016, los policías estatales y federales arremetieron en contra del pueblo indígena de Nochixtlán, Oaxaca. Gritando violentas consignas racistas, los policías de Gabino Cue y Enrique Peña Nieto acabaron con la vida de por lo menos ocho ciudadanos inocentes e hirieron de bala a más de cien más.


Todo con el fin de sembrar miedo y acabar con la protesta social.


Hace unos días en los Estados Unidos hubo un caso similar. Un joven neonazi que apoya a Trump atropelló con su auto una manifestación pacífica antifascista en Charlottesville, Virginia.


Tenemos la obligación de condenar todo acto de violencia independientemente de donde provenga, sea de parte de los fundamentalistas islamistas, de neonazis Trumpistas o del narcoestado Mexicano.


La humanidad reclama paz. Y los ciudadanos del mundo tenemos la obligación de unirnos en defensa de la vida, la justicia y la democracia.",RT,John Ackerman
86,10 millones de dólares. ¡Buena propina! Si deja a la mafia formar parte del poder,https://actualidad.rt.com/opinion/john-ackerman/247031-millones-dolares-corrupcion-mexico,15-08-2017,"De acuerdo con la prensa internacional, tres altos exejecutivos de la empresa Odebrecht han confesado en declaraciones juradas que pagaron diez millones de dólares a uno de los hombres más cercanos a Enrique Peña Nieto, Emilio Lozoya, con el fin de conseguir jugosos contratos petroleros.


Los depósitos fueron realizados tanto durante la campaña presidencial de Peña Nieto como una vez que Lozoya fuera designado como director general de Petróleos Mexicanos.


Para cubrir cualquier rastro de la transacción, se utilizaron cuentas bancarias escondidas en la pequeña isla de Tortola, en el Caribe, y en el minúsculo país de Liechtenstein, ambos conocidos como paraísos fiscales donde es casi imposible rastrear los dueños y los usuarios de las cuentas.


El señor Odebrecht se reunió con Peña Nieto el 1 de octubre de 2013. Unos días después, empezaron a fluir los depósitos más grandes.


En febrero de 2014, Odebrecht obtuvo, por adjudicación directa, un contrato con PEMEX por la cantidad de 1.436 millones de pesos para realizar trabajos en Tula, Hidalgo.


Lozoya dice que son puras mentiras. Han dicho lo mismo otros grandes amigos de Peña cuando los han agarrado con las manos en la masa, como Javier Duarte, César Duarte, Humberto Moreira, y Tomás Yarrington, entre muchos otros.


La Procuraduría General de la República ha dicho que va a investigar. También dice que va a investigar al futbolista Rafael Márquez y el cantante Julión Alvarez, ambos grandes amigos de Felipe Calderón y Peña Nieto.


Supongo que utilizarán las mismas estrategias, muy 'efectivas', que han utilizado para buscar el paradero de los 43 jóvenes de Ayotzinapa desaparecidos hace ya casi tres años.


¿Es aceptable esta situación de colapso total de la institucionalidad en el país?


La corrupción está desbordada y nadie hace nada.


La responsabilidad para cambiar las cosas, la tienes tú.",RT,John Ackerman
87,¿Para quién trabaja realmente el presidente mexicano?,https://actualidad.rt.com/opinion/john-ackerman/246442-trabaja-realmente-presidente-mexicano,08-08-2017,"""Somos tú y yo contra el mundo, Enrique, no lo olvides"", le dijo Trump a Peña Nieto en su llamada del pasado 27 de enero. ""Quiero que seas tan popular que tu pueblo pida una reforma constitucional para que puedas ser reelecto por otros seis años"", afirmó el presidente de EE.UU.


Lo único que te pido, amigo Enrique, es que:


dejes de hablar del muro;


no nos des lata sobre los derechos humanos de los migrantes mexicanos;


aceptes todas nuestras condiciones con respecto a la renegociación del Tratado de Libre Comercio de América Latina (TLCAN);


permitas acceso libre de nuestros militares al territorio mexicano;


frenes los migrantes centroamericanos;


y nos ayudes a derrocar violentamente a Nicolás Maduro en Venezuela para que todo el petróleo de la región nos pertenezca a nosotros.


""Claro que sí señor presidente"", responde una y otra vez Peña Nieto, ""a sus órdenes"".


Aun en este contexto, el canciller de Peña Nieto, Luis Videgaray, ha tenido la osadía y el cinismo de acusar a otros de ser ""cobardes"".


En particular, Videgaray ha acusado a Maduro de ""usar el poder del Estado para desmantelar la democracia y arremeter contra su propio pueblo"".


""El burro hablando de orejas"". O mejor se lo decimos 'in English' para que lo entienda el canciller entreguista: ""'People who live in glass houses, shouldn't throw stones'"".


México es, sin duda, el país latinoamericano que más violenta los derechos humanos y la institucionalidad democrática en toda la región. Ya basta.",RT,John Ackerman
88,¡Shhhhh! El Gobierno de Peña Nieto sí nos escucha y dice que es algo normal,https://actualidad.rt.com/opinion/john-ackerman/242643-pena-nieto-escuchas-espionaje-mexico,27-06-2017,"El régimen autoritario que ya tenemos se encuentra en transición hacia un sistema ""totalitario"", que no solamente reprime marchas, censura periodistas y roba elecciones, sino que también se entromete en la vida privada de todos y cada uno de nosotros, con el fin de controlar la totalidad de la vida pública y privada de los ciudadanos.


Vale la pena recordar lo que dicen las primeras dos frases del artículo 16 de la Constitución, que señala claramente que: ""Las comunicaciones privadas son inviolables"" y que ""la ley sancionará penalmente cualquier acto que atente contra la libertad y privacía de las mismas"".


¿Pero qué hace Peña Nieto al respecto?


Por un lado, pide que los ciudadanos lleven sus denuncias a las mismas instituciones señaladas de ser responsables de espiarlos ilegalmente.


Por otro lado, dice que a él también le intervienen sus teléfonos y que no nos deberíamos preocupar, porque es un asunto normal. Pero como decimos en México: ""Mal de muchos, consuelo de…"".


Además, Peña Nieto es autoridad pública y los ciudadanos tenemos el derecho a conocer lo que hace y dice. Lo que está prohibido es que él intervenga las comunicaciones privadas de los ciudadanos.


Peña Nieto no es víctima sino victimario. México merece un gobierno que lo proteja, en lugar de uno que agreda, censure y espíe al pueblo.


  ",RT,John Ackerman
89,¡Gracias Vicente! Tu apoyo irrestricto al régimen corrupto aclara lo que está en juego en 2018,https://actualidad.rt.com/opinion/john-ackerman/241791-vicente-fox-mexico-apoyo-regimen,20-06-2017,"El expresidente Vicente Fox ha declarado que él personalmente ""se va a encargar"" de que ""ese cuate"" –en referencia a Andrés Manuel López Obrador– no llegue al poder. 


Dice que AMLO es un ""populista"" y un ""demagogo"", que incluso lo trae en ""sus genes"". Pero el verdadero ""populista"" y ""demagogo"", además de hipócrita y sinvergüenza, eres tú, Chente. En el año 2000 tú prometiste sacar ""las tepocatas y las víboras prietas"" del poder. También juraste que la economía crecería un 7% al año durante tu mandato. Y prometiste democratizar el país, reformar el Estado y resolver el conflicto en Chiapas en 15 minutos.


Puras mentiras. Durante tu mandato hundiste la economía, sacrificaste la democracia y traicionaste al pueblo.


Dejaste escapar a 'El Chapo' Guzmán y pactaste desde el primer día con los priístas más retrógradas como Manlio Fabio Beltrones.


En 2006 primero lograste el desafuero de López Obrador y después organizaste el fraude electoral a favor de Felipe Calderón.


En 2012 llamaste a votar por Enrique Peña Nieto.


En realidad, lo único que te interesa es seguir cobrando tu pensión millonaria sin trabajar.


Afortunadamente, el pueblo mexicano ya no cree tus mentiras.


Nos encargaremos de que a partir de 2018 tú y todos los expresidentes dejen de cobrar del presupuesto y se pongan a trabajar.


Ya basta de privilegios y de mentiras. México merece un gobierno honesto y trabajador.


 ",RT,John Ackerman
90,"La OEA, vergonzoso cómplice del fraude electoral mexicano",https://actualidad.rt.com/opinion/john-ackerman/241229-oea-complice-fraude-electoral-mexico,13-06-2017,"Pero el pasado 4 de junio, en Coahuila y el estado de México, los mexicanos sufrimos un terrible fraude electoral. El régimen autoritario se niega a aceptar la derrota y se aferra al poder con dinero, con violencia y con conteos truqueados, subordinando a las instituciones democráticas. 


¿La reacción de la OEA? Silencio y complicidad absoluta.


Hay dos razones para esta actitud de la OEA. En primer lugar, la OEA se apega a la política exterior de los Estados Unidos. La organización recibe la mitad de su financiamiento del Gobierno de Donald Trump.


Y Luis Videgaray y Enrique Peña Nieto son grandes aliados de Washington. El Gobierno mexicano no defiende a los migrantes mexicanos en los Estados Unidos y ha invitado al Gobierno de los Estados Unidos a participar directamente en la vigilancia de la frontera sur con Guatemala.


En segundo lugar, el funcionario de la OEA responsable de la cartera del ""fortalecimiento democrático"", el 'Secretary for Stengthening Democracy' Francisco Guerrero Aguirre, es un convencido priista, desde siempre muy cercano a Emilio Gamboa Patrón.


Guerrero ha sido presidente del Instituto de Capacitación y Desarrollo Político de la Fundación Colosio y director general de la Fundación José Luis Lamadrid, organizaciones ambas ligadas al PRI.


En 2008, entró como consejero electoral del IFE, impulsado por el mismo Gamboa, y fue uno de los consejeros que más protegió a Enrique Peña Nieto durante las elecciones presidenciales de 2012 y avaló el fraude de aquel año.


El próximo 19 de junio, la OEA tendrá el descaro de celebrar su próxima Asamblea General en México. Originalmente tenían planeado celebrarla en la Ciudad de México, pero ante al miedo a las protestas del pueblo frente a la hipocresía de Almagro y Guerrero, han decidido realizarla en Cancún detrás de muros fortificados.


Es un escenario apropiado para una organización que cada día más se evidencia como un agente de Trump y un vil escudero del régimen autoritario mexicano.",RT,John Ackerman
91,Carta aclaratoria del Movimiento Antorchista Nacional y la respuesta del Dr. John M. Ackerman,https://actualidad.rt.com/opinion/john-ackerman/240714-movimiento-antorchista-nacional-replica-mexico,07-06-2017,"En respuesta a la opinión de Dr. John M. Ackerman publicada el 6 de junio del 2017, el Movimiento Antorchista Nacional envía un comentario que pueden encontrar aquí abajo:


Ackerman calumnia a Antorcha. Sus declaraciones no tienen sustento


* Los antorchistas hicimos uso de nuestro derecho a votar; rechazamos las ofensas de John Ackerman, vocero de López Obrador.


Ciudad de México.- El Movimiento Antorchista Nacional se deslinda de las declaraciones que realizó John M. Ackerman en un video que publicó en su cuenta de Facebook, y en el que posteriormente retomó RT, en el que se dice que Antorcha participó en la compra de votos; “Antorcha rechaza las acusaciones de Ackerman, es totalmente falso que nuestra organización haya participado en eventos como los que señala, eso es una declaración sin sustento y por tanto una calumnia vil”.


En el video titulado “5 razones para dudar de la 'verdad histórica' que nos quieren imponer” se menciona que durante la jornada electoral del domingo 4 de junio se desplegó uno de los operativos de compra y de coacción del voto más grande en la historia de México… “Se movilizaron maestros, enfermeras, doctores, transportistas, antorchistas, para comprar el voto, para acarrear a los ciudadanos, para manipular la voluntad popular”; en ese video la información es totalmente falsa y sin ninguna prueba, señaló la oficina de comunicación del Movimiento Antorchista.


Por otro lado el importante portal de información RT, transcribe lo que se dice en ese video y se sigue acusando a Antorcha, asegurando que “Participaron de manera particularmente importante los sindicatos de maestros, enfermeras y doctores, así como organizaciones de transportistas y organizaciones sociales como Antorcha Campesina”.


Al respecto, el Movimiento Antorchista señala:


Primero: Las declaraciones que hace John M. Ackerman son totalmente falsas pues no se presenta ni la más mínima prueba para sustentar lo que dice. Nuestra organización participó en las elecciones de manera responsable, con apego a la democracia y en completa paz. Los antorchistas hicimos uso de nuestro derecho a votar.


Segundo: Las afirmaciones de Ackerman ofenden a un grupo muy numeroso de trabajadores organizados en el Movimiento Antorchista, que ven con indignación que ese señor los maltrate y los ofenda, simplemente porque quiere llevar agua al molino de López Obrador.


Tercero: El diario RT, transcribiendo lo que dice Ackerman, replica una calumnia contra nuestra organización, que siempre se ha manejado, en todos sus actos políticos y culturales, con estricto apego a la legalidad.


Recordamos a RT que Antorcha es una organización política que surgió hace 43 años y que desde entonces su actividad siempre ha sido para ayudar y defender a los mexicanos más pobres del país,  pero siempre dentro del marco de nuestra Constitución; por tanto, es falso que Antorcha haya participado en eventos que dañen nuestra democracia, como lo quiere hacer creer el señor Ackerman.


El Movimiento Antorchista tienen presencia en todo el país y ya cuenta con una membresía de más de 2 millones 300 mil mexicanos, y eso demuestra cómo miles de mexicanos se han ido sumando a nuestras filas, simplemente porque ven en nuestro actuar, a alguien que les puede ayudar a resolver algunas de sus necesidades más apremiantes como: vivienda, educación, salud y apoyos al campo.


 RESPUESTA DEL VIDEOCOLUMNISTA


1.       Los comentarios que un servidor realizó en la videocápsula del pasado 6 de junio de 2017 sobre la realización de “uno de los operativos de compra y coacción del voto más grandes de la historia” durante las últimas elecciones para gobernador en el Estado de México, en lo cual habrían participado maestros, doctores, enfermeras, transportistas y “antorchistas”, se basa tanto en información pública recogida por los medios de comunicación como en los recorridos, los informes y las denuncias ciudadanas recibidas por la iniciativa ciudadana #NiUnFraudeMás (www.niunfraudemas.org).


2.       Rechazo categóricamente que las afirmaciones busquen “llevar agua al molino de López Obrador”, figura pública a quien no menciono una sola vez en la videocápsula correspondiente.  La lucha por la democracia y la justicia es una causa que corresponde a todos los ciudadanos sin distinción alguna de partido o de ideología.


3.       No existe ninguna “calumnia” en contra del “Movimiento Antorchista Nacional” ya que jamás se le menciona a la organización por nombre, ni se utiliza ningún símbolo referente a esta organización, ni se le atribuye delito alguno.


4.       Finalmente, solamente la persona más ingenua pudiera creer que el “Movimiento Antorchista Nacional” sea una organización que siempre se comporta “con apego a la democracia y en completa paz” y “con estricto apego a la legalidad”, como señala su carta de réplica.  La íntima relación entre esta organización y el Partido Revolucionario Institutional (PRI) y sus gobiernos es conocida por todos y existen numerosas denuncias públicas con respecto a su comportamiento. Por ejemplo, durante el proceso electoral en el Estado de México numerosos militantes del partido Morena han señalado a miembros del Movimiento Antorchista por fomentar actos de violencia en su contra.


Dr. John M. Ackerman, Instituto de Investigaciones Jurídicas, Universidad Nacional Autónoma de México (UNAM)",RT,John Ackerman
92,5 razones para dudar de la 'verdad histórica' que nos quieren imponer,https://actualidad.rt.com/opinion/john-ackerman/240590-alfredo-mazo-eleccion-mexico,06-06-2017,"No se dejen engañar. Alfredo del Mazo no ganó la elección en el estado de México. Aquí cinco razones para dudar de la 'verdad histórica' que los mismos de siempre quieren imponer.


1. El 'conteo rápido' divulgado el domingo 4 de junio por el Instituto Electoral del Estado de México en la noche misteriosamente no incluyó 500 casillas de la muestra originalmente programada. El Instituto no ha informado cuáles casillas finalmente tomaron en cuenta para la muestra y cuál fue su metodología. Aun así, el resultado no da a Del Mazo como ganador, sino que arroja un claro empate técnico entre Del Mazo y Delfina Gómez.


 2. Durante las horas y días después del cierre de casillas se han divulgado cientos de irregularidades en el cómputo de las actas en el Programa de Resultados Preliminares del IEEM. No son errores humanos. Sorpresivamente todas las irregularidades tienen la misma característica, aumentan los votos al PRI y sus partidos aliados y los reducen para Morena.


 3. Durante la jornada electoral del domingo 4 de junio se desplegó uno de los operativos de compra y coacción del voto más grande en la historia de México. Miles de votantes fueron acarreados y presionadospara votar a favor de Del Mazo. Participaron de manera particularmente importante los sindicatos de maestros, enfermeras y doctores, así como organizaciones de transportistas y organizaciones sociales como Antorcha Campesina. Todo ello es una clara violación del derecho a elecciones limpias, libres y auténticas señalada en el artículo 41 de la Constitución.


 4. Durante el periodo de 'veda' electoral se desplegó una campaña electoral ilegal en beneficio de Del Mazo en que se gastaron millones de pesos para distribuir cientos de miles de volantes, realizar cientos de miles de mensajes de texto y contratar masivamente publicidad en Internet para denostar al partido Morena y engañar a los ciudadanos con respecto a la forma correcta para votar para su candidato Delfina Gómez.


 5. Tanto instituciones gubernamentales como delincuentes comunes desplegaron una estrategia de violencia y de miedo en contra de Morena y sus representantes. Se realizaron llamadas telefónicas amenazantes, se colocaron ofrendas sangrientas, robaron urnas, policías allanaron un hotel en Tejupilco donde estaba la delegación de Morena, circularon oficios apócrifos del IEEM y la FEPADE, desaparecieron representantes de Morena y agredieron observadores electorales.


NINGÚN SISTEMA DEMOCRÁTICO PERMITE ESTE TIPO DE ATROPELLOS. SI INSISTEN EN IMPONER A DEL MAZO, LOS TRIBUNALES TENDRÍAN QUE ANULAR SU SUPUESTA VICTORIA Y ORDENAR LA REALIZACION DE UNA NUEVA ELECCIÓN.


Del Mazo no ganó. Los mexicanos merecemos votar en paz y libremente.


*Desde el Movimiento Antorchista Nacional, nos enviaron una respuesta a las opiniones expresadas en este artículo. Para leerla haga clic aquí.",RT,John Ackerman
93,"""Los políticos creen que pueden comprar la Luna: ¡Urge que México dé buenas noticias al mundo!""",https://actualidad.rt.com/opinion/john-ackerman/239845-urge-mexico-buenas-noticias-mundo-nieto,30-05-2017,"Ellos creen que todo se resuelve con dinero, que pueden comprar el Sol, la Luna, la dignidad y la democracia.


Todos los informes indican que tienen preparado un enorme operativo de compra y coacción del voto en todo el estado de México, así como en Veracruz, Coahuila y Nayarit para este domingo, 4 de junio, utilizando recursos públicos y privados ilegales.


Se llama crimen organizado. La movilización de millones de personas para cometer el delito de defraudación de la voluntad popular. Si ganan, usted no se haga el sorprendido cuando al llegar al Gobierno sigan robando.


Por otro lado, también saldrán millones de ciudadanos libres, listos para expresar su indignación en las urnas, convencidos de la necesidad de un cambio en la forma de hacer política.


Ténganlo claro: no hay fraude que pueda derrotar a la ciudadanía cuando salimos en masa a participar. Podrán comprar a algunos, pero no podrán comprarnos a todos. Somos demasiados y nuestra dignidad, simplemente, no tiene precio.


Pero no es suficiente solo con votar. También hay que vigilar, denunciar y exigir.


¿Sabes dónde se pondrán las 'casas amigas' para comprar votos el día de la elección? ¿Conoces los números de teléfono donde hay que enviar fotos de tu voto para cobrar la recompensa?


Denúncialo a www.niunfraudemas.org. Juntos podemos derrotar al fraude. Participa.",RT,John Ackerman
94,El PRD ha muerto: El partido del pueblo se acuesta con el de las élites,https://actualidad.rt.com/opinion/john-ackerman/239216-prd-muerto-mexico-lucha,23-05-2017,"El PRD nació el 5 de mayo de 1989 como una vía para dar cauce a la enorme indignación ciudadana que surgió a raíz del fraude electoral de 1988.


En su momento, reunió a los líderes políticos y sociales más valiosos del país con el fin de juntos derrocar pacíficamente la dictadura del PRIAN, encabezado por Carlos Salinas de Gortari y Diego Fernández de Cevallos.


Pero el anuncio de que el PRD ahora se aliará con el PAN para las elecciones presidenciales de 2018 implica el fin definitivo del Sol Azteca como partido independiente y lo convierte en el 'Partido Verde del PAN', un simple palero del régimen autoritario.


El partido de la esperanza democrática ahora camina de la mano con el partido del fraude y de la violencia. 


El partido del pueblo y de los movimientos sociales ahora se acuesta con el partido de las élites y los oligarcas.


El partido de la soberanía y la independencia nacional ahora se arrodilla frente al partido que ruega la intervención estadounidense en las elecciones presidenciales de 2018.


¿Tiene algún sentido que las bases del PRD reclamen a sus líderes, a esos mismos dirigentes que firmaron el Pacto por México y apoyaron la candidatura de Miguel Angel Yunes en Veracruz?


Sería inútil. La única respuesta efectiva, me parece, sería simplemente darle la espalda a estos nuevos paleros del sistema y elegir otro camino.


En todo el mundo los partidos de la vieja izquierda hipócrita, corrupta y burocratizada están encontrando su fin y empiezan a surgir nuevos movimientos políticos que enarbolan la esperanza ciudadana en un nuevo régimen. 


México es un gran país y merece un gobierno a la altura de su pueblo.",RT,John Ackerman
