,title,link,date,body,source,author
19,"Amenazar, exigir y chantajear: la política de Trump hacia México",https://actualidad.rt.com/opinion/john-ackerman/317785-amenazar-exigir-chantajear-politica-trump-mexico,12-06-2019,"Derrotamos los aranceles de Donald Trump, pero los mexicanos no podemos descansar en nuestros laureles. Continuarán las agresiones y debemos estar unidos para las batallas que vienen.


Donald Trump ya demostró su enorme mala fe hacia México. En respuesta a la mano extendida de Andrés Manuel López Obrador, su apertura permanente al diálogo y al respeto mutuo entre las naciones, el ocupante de la Casa Blanca prefirió golpear la mesa y recurrir a amenazas y chantajes.


El presidente López Obrador no cayó en la provocación y México salió muy bien librado de la presente crisis. Sin embargo, se rompió la confianza bilateral y tenemos que prepararnos para lo que viene.


El primer reto es perderle el miedo a Trump. Sus amenazas son vacías, el típico 'bluff' de un jugador de póker.


Una guerra comercial con México sería demasiado costosa para él, sobre todo en el contexto de su conflicto con China y las próximas elecciones presidenciales.


Estados Unidos importó 347.000 millones de dólares en bienes de México durante 2018, incluyendo tractores, computadoras, coches, aguacates, lavadoras y mangos, entre muchos más. Un arancel del 25 % implicaría un impuesto de 87.000 millones a los consumidores estadounidenses, algo que lastimaría su economía de manera importante.


Y si México respondiera con aranceles similares se generaría una fuerte crisis para los productores estadounidenses. México importa unos 300.000 millones de bienes y servicios al año desde su vecino del norte.


La imposición unilateral de nuevos aranceles también implicaría una violación flagrante a la propia Constitución de los Estados Unidos.


La Sección Octava del Primer Artículo de su Carta Magna dice sin rodeos que es el Congreso de la Unión, no el Poder Ejecutivo, el que cuenta con la facultad originaria y exclusiva de ""regular el comercio con naciones extranjeras"".


Cualquier nuevo arancel debe ser avalado por el Poder Legislativo, donde Trump no tiene mayoría.


Nuevos aranceles también violarían las reglas, tanto de la Organización Mundial del Comercio como del Tratado de Libre Comercio. Estos acuerdos permiten la aplicación de aranceles en respuesta a una agresión comercial de otro país, pero prohíben de manera tajante su aplicación de manera unilateral o para lograr cambios políticos, como una modificación en la política migratoria de un país vecino.


Ahora bien, para salir al paso Trump recurre a la 'International Emergency Economic Powers Act'. Esta ley fue aprobada en 1977 para permitir al presidente de EE.UU. tomar represalias económicas en contra de los enemigos políticos de Washington en caso de que existiera ""una amenaza internacional inusual y extraordinaria"".


En otras palabras, Trump considera a México y a todos los mexicanos y centroamericanos como sus enemigos.


¿Cómo espera que respondamos, entonces?


México podría también exigir y chantajear, ¿eh?


Por ejemplo, a Trump le gusta hablar de 'invasiones' pero, en realidad, es México quien sufre una verdadera invasión, desde el norte, de miles de armas de alto poder y también de dinero sucio del narco.


¿Qué tal si México amenazara con suspender sus exportaciones de petróleo o cerrar la frontera norte hasta que EE.UU. redujera su consumo de drogas y acabara con el tráfico de armas?


Lo mejor es llevar la fiesta en paz, desde luego, pero los mexicanos tampoco podemos permitir que ningún poder extranjero dicte nuestra política interior.",RT,John Ackerman
20,El futuro del neoliberalismo en América Latina,https://actualidad.rt.com/opinion/john-ackerman/315577-futuro-neoliberalismo-america-latina,22-05-2019,"A pesar de las victorias recientes de la derecha en Sudamérica, el neoliberalismo es en realidad una ideología cada vez más trasnochada e ineficaz.


El fracaso del Gobierno de Mauricio Macri en Argentina, por ejemplo, es un excelente botón de muestra.


Mauricio Macri ganó estrechamente las elecciones presidenciales de 2015, por apenas 3 % de la votación. Su principal oferta de campaña era fortalecer la economía a partir de la aplicación de la vieja receta neoliberal, incluyendo la eliminación de impuestos, controles y subsidios, así como una total “apertura” hacia los mercados internacionales y financieros.


Macri llenó su gabinete con exdirectivos de empresas transnacionales, muchos con estudios de posgrado en el extranjero, y estableció un Gobierno elitista y tecnocrático al estilo de Carlos Salinas de Gortari en 1988 o de Vicente Fox en 2000 en México.


El resultado ha sido desastroso.


Desde que Macri llegó al poder, en 2015, la tasa de inflación ha pasado de cero a más de 40 %.


Durante el mismo periodo, el peso argentino se ha devaluado en 400 %, pasando de 10 a casi 40 pesos por dólar estadounidense.


Macri también ha aumentado estratosféricamente la deuda pública, 50 % desde el inicio de su mandato, algo supuestamente en contra de los principios de austeridad de los gobiernos neoliberales. 


Hoy, cada vez más argentinos deben comer de la basura para sobrevivir y muchos se quedan sin luz y agua por los altos precios de los servicios públicos.


Pero en lugar de corregir el rumbo, en respuesta a esta crisis económica el Banco Central de Argentina ha seguido la misma ortodoxia neoliberal, aumentado las tasas de interés arriba de 60 %, lo cual ha sofocado aún más a la economía.


Macri también ha recurrido al Fondo Monetario Internacional para un préstamo de emergencia de unos 56 mil millones de dólares.


Ello implica un imperdonable sacrificio de soberanía económica para muchos argentinos. Todavía están muy presentes los recuerdos de como el FMI participó en el colapso de la economía argentina al principio del siglo XXI.


Los neoliberales no aprenden. Se repite la historia de los años 90, cuando estas mismas políticas generaron miseria y desigualdad a lo largo y ancho de América Latina.


Pero la buena noticia es que en esta ocasión la época neoliberal durará mucho menos.  Los latinoamericanos ya sabemos a dónde va el cuento de las “reformas estructurales” y no nos dejamos engañar tan fácilmente.


La popularidad de Macri se ha colapsado, por ejemplo. Hoy se encuentra en apenas 25 %.


El neoliberalismo ya no funciona ni convence como antes, y los anhelos democráticos de los latinoamericanos son más fuertes que nunca.


Los conservadores tendrán que reinventarse o, simplemente, acostumbrarse a ser oposición, ya que los pueblos del mundo se han despertado.",RT,John Ackerman
21,El Gobierno de EE.UU. contra Cuba,https://actualidad.rt.com/opinion/john-ackerman/314111-gobierno-eeuu-cuba,07-05-2019,"¡Cuba, sí! ¡Yanquis, no! Las nuevas acciones del Gobierno estadounidense en contra de la República de Cuba implican una violación flagrante del derecho internacional y una agresión inaceptable a la autodeterminación de los pueblos del mundo.


El Congreso de Estados Unidos aprobó la Ley Helms-Burton en 1996 con el fin de profundizar el embargo comercial contra Cuba, hundir la economía de la isla y derrocar a Fidel Castro. Fracasaron. La Revolución cubana sobrevive y cuenta con gran apoyo popular, aun después de la dimisión de Castro como presidente en 2008 y su muerte, por causas naturales, en 2016. Barack Obama reconoció la derrota de la estrategia intervencionista de Washington y, en 2015, se reabrieron las embajadas en La Habana y Washington y se permitieron vuelos comerciales entre Cuba y EE.UU., así como mayores transferencias de remesas e intercambio comercial. Pero Donald Trump ha decidido no solamente suspender la apertura de Obama, sino regresar a los peores tiempos de la Guerra Fría y la Doctrina Monroe. Ha decidido echar a andar el Titulo Tercero de la Ley Helms Burton, que permitirá la presentación de unas 200.000 demandas judiciales en tribunales estadounidenses en contra de las expropiaciones realizadas después de la Revolución cubana de 1959.


La ley cubre no solamente propiedades que eran de estadounidenses en aquel momento, sino también aquellas que pertenecían a cubanos que después migrarían a EE.UU.


Este título de la ley no había sido aplicado por su evidente violación del derecho internacional. Imaginemos, por ejemplo, que los tribunales de México, de repente, permitieran demandas presentadas por los pueblos indígenas de Texas y California reclamando sus territorios despojados por los estadounidenses durante la guerra con México entre 1846 y 1848.


¿O qué tal si España decidiera dar entrada a los juicios de los descendientes del rey Fernando VII reclamando sus territorios perdidos en la independencia de México?


¿O cómo reaccionarían los mexicanos si los tribunales de EE.UU., de repente, decidieran devolver a las empresas petroleras internacionales las propiedades que tenían antes de la expropiación de Lázaro Cárdenas en 1938?


Ahora bien, Mike Pompeo dice que las nuevas agresiones a Cuba se justifican por ""la opresión brutal del Gobierno cubano a los derechos humanos y las libertades fundamentales"" de su población y por ""el apoyo indefendible [de Cuba] a los regímenes cada vez más autoritarios y corruptos de Venezuela y Nicaragua"".


Pero quien, en realidad, viola los derechos humanos y coarta las libertades de los cubanos no es La Habana, sino Washington con su embargo y sus sanciones. Hay que ser muy claros.


La activación del Título Tercero de la Ley Helms-Burton implica nada menos que una invasión jurídica de la isla caribeña, un intento de expropiación neocolonial de los territorios de una nación extranjera por Donald Trump. Más allá de las ideologías y los importantes debates con respecto al futuro político y económico de Cuba, la condición 'sine qua non' para el mejoramiento de las condiciones de vida para todos los habitantes de la isla es el respeto absoluto a la soberanía nacional, así como el fin de sanciones internacionales, que solamente generan más sufrimiento para los cubanos más pobres y vulnerables.


¡Cuba, sí! ¡Yanquis, no!",RT,John Ackerman
22,El caso de Assange simboliza la hipocresía de los países del norte y la traición de los gobiernos de Sudamérica,https://actualidad.rt.com/opinion/john-ackerman/312624-ackerman-caso-assange-presos-politicos-libertad,23-04-2019,"Julian Assange es un preso político. Su encarcelamiento simboliza tanto la hipocresía de los países del norte (que, supuestamente, promueven la democracia y la libertad de expresión) como la traición a las causas populares de los nuevos gobiernos neofascistas de Sudamérica, como Lenín Moreno en Ecuador.


Julian Assange no ha cometido delito alguno. Las investigaciones del Gobierno sueco en su contra por presunto abuso sexual en contra de dos mujeres han sido archivadas por falta de pruebas.


Desde 2015, el Grupo de Trabajo sobre Detenciones Arbitrarias de la ONU condenó la persecución judicial en contra de Assange y exigió su liberación. Y las nuevas acusaciones del Gobierno de EE.UU. no tienen pies ni cabeza. Se le acusa a Assange de, supuestamente, haber ""conspirado"" con la militar estadounidense Chelsea Manning en 2010, cuando lo único que hizo Assange fue publicar, como cualquier periodista, los cables y los videos extraídos por Manning.


Recuerden, por ejemplo, el escalofriante video de un helicóptero estadounidense en Irak asesinando a mansalva y a sangre fría a 12 personas, incluyendo dos periodistas de Reuters. Y, ¡ojo!, la información filtrada por Manning no se publicó solamente en WikiLeaks, sino también en The New York Times, The Guardian y Der Spiegel.


En México, la información fue publicada por el periódico La Jornada y sirvió para evidenciar el oscuro pacto sellado por Felipe Calderón y el Gobierno de EE.UU. en 2006. Específicamente, se reveló que George Bush Jr. apoyó al fraude electoral a favor de Calderón a cambio del entreguismo del nuevo presidente a Washington en materia migratoria, petrolera y de 'guerra' contra el narcotráfico, entre otros temas.


Si los tribunales estadounidenses condenan a Assange por espionaje, tendrían que castigar también a los directores de los otros importantes medios de comunicación que publicaron la misma información.


El verdadero motivo por el nuevo acoso a Assange es el desesperado intento de Donald Trump de sacudirse las acusaciones de que él mismo estuviera detrás de la publicación por WikiLeaks de los correos electrónicos de Hillary Clinton y su equipo durante la campaña presidencial de 2016. Frente a los ataques por la supuesta alianza del presidente estadounidense tanto con el Gobierno ruso como con la empresa Cambridge Analítica, Trump hoy agarra a Assange como su chivo expiatorio.


Pero, en realidad, Assange jamás se ha aliado con ningún gobierno o fuerza política partidista, sino todo lo contrario. Su lucha ha sido siempre de la mano con la sociedad y a favor de la verdad y la transparencia. Es precisamente por este compromiso que en EE.UU. tanto Clinton como Trump, tanto los demócratas como los republicanos, lo han llamado ""terrorista"" e, incluso, pedido su muerte.


En Ecuador, Assange también ha sido víctima de un linchamiento político. Con el retiro de inmunidad diplomática al fundador de WikiLeaks, el presidente de Ecuador, Lenín Moreno, ha consolidado su traición a cualquier principio democrático o de izquierda. Cada día, este líder se parece más a Juan Guiadó o a Jair Bolsonaro, cuyos únicos intereses son servir a la oligarquía, la intolerancia y al imperio.


La necesaria defensa de Julian Assange rebasa fronteras y ideologías. Todos y todas que valoren la libertad, la democracia y la justicia deberían apoyar la causa de este importante periodista y activista social.


¡Presos políticos libertad!",RT,John Ackerman
23,El diálogo entre López Obrador y el rey de España no va bien,https://actualidad.rt.com/opinion/john-ackerman/311158-dialogo-lopez-obrador-rey-espana,09-04-2019,"El Reino de España ha rechazado la atenta invitación de la República de México a celebrar una reconciliación histórica. Como durante la misma colonia, el viejo continente expresa su desdén y desprecio hacia las Américas. Mientras, el nuevo mundo avanza con paso firme hacia la modernidad.


El pasado 1 de marzo de 2019, el presidente constitucional de los Estados Unidos Mexicanos envió una carta a su majestad el rey de España invitándolo a construir ""un relato compartido"" sobre la conquista de las Américas con el fin de reconciliar las dos naciones con la historia y consigo mismas para, así, generar ""una convivencia más estrecha, más fluida y más fraternal"" entre los dos pueblos.


La carta fue redactada con gran respeto y gallardía por el presidente mexicano, pero respondida con enorme altanería por el Estado español. 


En lugar de estrecharle la mano a Andrés Manuel López Obrador, España rechazó ""con toda firmeza"" el contenido de la carta y cerró de una vez la puerta a la posibilidad de un gran evento conjunto en 2021, con motivo de los 500 años de la caída de Tenochtitlán.


Recordemos que México ha sido una República casi desde su nacimiento. ¡Pero España todavía tiene un rey! Y no sólo España. También Inglaterra, Bélgica, Dinamarca, los Países Bajos, Suecia, Noruega y Arabia Saudita, entre muchos otros. Y la invasión del ahora territorio mexicano se realizó bajo el auspicio y la responsabilidad, precisamente, de la Corona Española. 


Hernán Cortés desembarcó en Veracruz hace exactamente 500 años, el 22 de abril de 1519. Durante las siguientes décadas, la población de nuestro territorio pasó de 11 millones a apenas 2 millones de habitantes. Una brutal masacre. ¡Un verdadero genocidio! Ahora bien, si los españoles no quieren pedir perdón por este pasado infame, existe otra opción. Podrían, simplemente, acabar con la institución responsable por estos crímenes: la Corona española. Es decir, que España se convierta en una verdadera república, como México, por ejemplo. No suena tan descabellada la idea, ¿o sí?


Lo que no se vale es chiflar y comer pinole, como decimos en México. Si los españoles quieren seguir teniendo un rey, que ese monarca demuestre que es una persona ilustrada, moderna y responsable a partir de un claro deslinde histórico y un abrazo fraternal a la hermana República de México. 


La carta de López Obrador no busca fomentar la división o el resentimiento entre razas, pueblos o naciones, sino todo lo contrario: busca construir un camino hacia la paz, la fraternidad y la sororidad entre las naciones.


Las heridas históricas solamente se suturan cuando se reconocen. De lo contrario, el expediente se mantendrá abierto y el viejo continente seguirá perdiendo influencia y liderazgo en el mundo cada vez más complejo y multipolar del siglo XXI.",RT,John Ackerman
24,La guerra sucia contra López Obrador y Ackerman,https://actualidad.rt.com/opinion/john-ackerman/309785-guerra-sucia-lopez-obrador-ackerman,26-03-2019,"Saludos, Enrique. Hola, soy yo, el agente ruso. ¿Recuerdas cuando desataste una brutal guerra sucia en mi contra, señor Krauze? Quisiste tumbar a López Obrador, pero fracasaste en el intento.


La supuesta trama rusa en las elecciones mexicanas jamás existió. Nunca hubo intervención alguna de Moscú ni en las redes sociales ni en las campañas políticas.De acuerdo conel escritor Ricardo Sevilla, todo fue una vil fabricación de un grupo a cargo de Fernando García Ramírez, trabajando bajo el mando intelectual de Enrique Krauze y patrocinado por el oligarca Agustín Coppel. Querían acabar con esta videocolumna y parar la marcha triunfal de López Obrador.Pero aquí sigo…y ahí está el 'rayito de esperanza' despachando en Palacio Nacional.


""¡Publiquen sin miedo, carajo! ¡Tenemos presupuesto ilimitado!"", gritaba el coordinador de la granja de trols en Berlín 245. Los testimonios indican que llegaban a pagar hasta 50.000 pesos por cada meme en las redes sociales en contra de López Obrador durante la campaña presidencial de 2018. Este equipo también manejaba varios sitios web como Pejeleaks, Mexico Prensa y Populismo Autoritario, que publicaban una avalancha de calumnias y noticias falsas en contra del candidato de Morena. Así que la verdadera infiltración política no fue desde Moscú, sino desde la oligarquía nacional, que temía perder sus enormes privilegios.


Es importante señalar que esta campaña políticoelectoral supuestamente financiada por la familia Coppel y otros magnates, como Alejandro Ramírez y Germán Larrea, violaría a todas luces las leyes electorales. El artículo 54 de la Ley General de Partidos Políticos prohíbe que los candidatos reciban cualquier donación de parte de ""personas morales""; es decir, de empresas u organizaciones de la sociedad civil. Y el artículo 56 impone un tope muy estricto a las aportaciones de individuos y, además, obliga a los partidos a informar al Instituto Nacional Electoral sobre estas contribuciones, algo que no ocurrió de ninguna manera en este caso. No hay duda: las autoridades electorales están obligadas a investigar y castigar este evidente atropello a la ley.


Pero la buena noticia es que, a pesar de la guerra sucia, a pesar de las mentiras y la infiltración de las redes, la indignación y la esperanza ciudadanas fueron tan poderosas que lograron derrotar las estrategias de fraude en las elecciones presidenciales. Pero no podemos descansar en nuestros laureles. Vendrán nuevos embates autoritarios de parte de los neoliberales neofascistas. Ya lo hemos visto en EE.UU. con Donald Trump, en Brasil con Jair Bolsonaro y en Venezuela con Juan Guaidó. Hay que mantener la frente en alto y redoblar nuestra lucha por la democracia, la libertad, la justicia y la verdad.",RT,John Ackerman
25,"Cruzada en contra del ""socialismo""",https://actualidad.rt.com/opinion/john-ackerman/308366-cruzada-socialismo-eeuu-guerra-fria,12-03-2019,"La Guerra Fría terminó hace tres décadas, pero algunas personas no se han dado cuenta y emprenden hoy una violenta cruzada en contra del ""socialismo"" en el planeta entero


¿Pero qué es exactamente el ""socialismo""? ¿Es realmente tan maligno como dicen?


El vicepresidente de Estados Unidos, Mike Pence, dice que la gran disyuntiva hoy para los pueblos del mundo es entre la libertad y el socialismo, entre la responsabilidad personal y la dependencia gubernamental. 


Pues aquí un dato para usted, señor Pence: el gasto militar de EE.UU. asciende a unos 590.000 millones de dólares al año, más que el total de los siguientes siete países juntos.


Cada año, EE.UU. utiliza Casi el 50 % de su gasto programable, —lo cual equivale, aproximadamente, a un 14 % de su presupuesto total— en asuntos militares.


¡Claro! Pero este enorme gasto no implica ninguna ""dependencia gubernamental"" y las Fuerzas Armadas de EE.UU. trabajan a favor de la ""libertad"".


¿Verdad, Mr. Pence? ¿Cómo en Venezuela, por ejemplo?


Al parecer, usted no está informado de que, en EE.UU., el 15 % de la población se encuentra debajo de la línea de pobreza, un porcentaje mayor al de decenas de otros países, incluyendo Francia, Canadá, Rusia, Hungría y Dinamarca.


En su propio país, cientos de miles de vagabundos están obligados a dormir en las calles y escarbar en la basura para su comida diaria.


Las escenas que retrató Jorge Ramos no ocurren solo en Venezuela, ¿eh? En EE.UU., el 25 % de los niños viven en condiciones de pobreza, lo cual coloca a este país en el sitio 34 de entre las naciones desarrolladas, detrás de todos los países europeos y también de Australia, Canadá, Japón y Nueva Zelanda. 


¡Y sorpresa! 


EE.UU. prepara nuevas y ""significativas sanciones"" contra Venezuela


Esos países donde casi no hay pobreza y los niños crecen sanos son, precisamente, naciones donde el gobierno gasta menos en armamento militar y más en proveer servicios públicos de educación, de salud y de bienestar. 


¡Así es, señor Pence! Eso que usted llama ""socialismo"" funciona para construir sociedades sanas y fuertes, una condición necesaria para que todos y todas, precisamente, puedan desarrollar libremente sus capacidades y sus planes de vida. 


Entiendo que esto choca con su lógica, señor Pence. Al parecer, usted sigue viviendo en la época de la Guerra Fría, cuando se planteó una guerra a muerte entre dos sistemas radicalmente contrapuestos: el capitalismo y el comunismo. Pero le informo, señor vicepresidente, que el Muro de Berlín se cayó en 1989. ¡Hace 30 años! 


Hoy queda claro que la única salida es a partir de una combinación sincrética y de apoyo mutuo entre los principios de igualdad y de libertad, entre la competencia y la justicia, entre el individuo y la colectividad. Le doy la bienvenida al siglo XXI, señor Pence, y le presento la modernidad. Nunca es demasiado tarde para aprender algo nuevo. ",RT,John Ackerman
