,title,link,date,body,source,author
45,El 'statu quo' se está colapsando en todo el planeta,https://actualidad.rt.com/opinion/john-ackerman/281980-statu-quo-esta-colapsando-planeta,18-07-2018,"El 'statu quo' se está colapsando en todo el planeta. Los votantes están abandonando en masa a los viejos partidos políticos, los de derecha, los de izquierda y los de centro, y están surgiendo nuevas opciones.


En los Estados Unidos, la ola de repudio colocó a un neofascista en la Casa Blanca.


En Francia, la indignación ciudadana también fue canalizada hacia la derecha, con la victoria del exbanquero Emmanuel Macron.


En Reino Unido, el coraje con el sistema imperante generó el 'Brexit'; en España casi se logra la independencia de Cataluña.


En América Latina, Mauricio Macri surfeó la ola del descontento con el statu quo para llegar al poder en Argentina. Y en Brasil y Ecuador, las instituciones también empiezan a debilitarse a partir de la persecución jurídica en contra de Luiz Inácio Lula da Silva y Rafael Correa.


Pero en México estamos viviendo un proceso excepcional. Esa misma ola de repudio ciudadano no ha generado ni inestabilidad ni un giro hacia la derecha.


Con la victoria de López Obrador se rompe de tajo con la hipocresía de la ""tercera vía"", ese neoliberalismo vestido de seda de Bill Clinton, Tony Blair y Vicente Fox, pero sin lanzarse al vacío ni caer en las garras de la reacción.


Hoy, desde México, como en la época de la Revolución de 1910, se genera una nueva opción social, libertaria y profundamente revolucionaria que servirá de ejemplo para el mundo entero",RT,John Ackerman
46,"México, ante una nueva época con López Obrador",https://actualidad.rt.com/opinion/john-ackerman/280991-lopez-obrador-futuro-presidente-mexico,11-07-2018,"Andrés Manuel López Obrador no solo ganó la elección presidencial: Morena, su partido, también barrió el país entero. Se abre, sin duda, una nueva época histórica. 30 millones de mexicanos, el 53 % de los electores, votamos por López Obrador, por la esperanza y por el cambio.


El tabasqueño duplicó la cantidad de votos recibidos por Vicente Fox en el año 2000 y dejó muy atrás tanto a Ricardo Anaya como a José Antonio Meade. López Obrador ganó en 31 de las 32 entidades federativas, desde Tijuana hasta Tapachula, desde Matamoros hasta Acapulco.


Solamente Guanajuato se quedó fuera de la enorme ola de rebelión ciudadana. En Tabasco, López Obrador recibió el 80 % de la votación; en Oaxaca, el 65 %; en Guerrero, el 63 %. También dos terceras partes de los votos desde el extranjero fueron para AMLO.


La coalición Juntos Haremos Historia contará con una clara mayoría, tanto en el Senado de la República como en la Cámara de Diputados. También ganó la mayoría de las presidencias municipales y diputaciones locales en disputa, hasta en lugares tradicionalmente bajo un férreo control caciquil, como Hidalgo y el Estado de México.


Todo esto implica una enorme responsabilidad. El contundente mandato popular expresado en las urnas debe generar un Gobierno radicalmente diferente, cercano a la gente, comprometido con la justicia social, la democracia y los derechos humanos. No mentir, no robar y no traicionar: es el compromiso de López Obrador.


Tomemos la palabra al futuro presidente y reconstruyamos juntos la Nación. Con la participación de todos y todas, acabemos con la violencia, la corrupción y la pobreza.",RT,John Ackerman
47,"""Un gran líder"": A la tercera, AMLO ganó las elecciones presidenciales en México",https://actualidad.rt.com/opinion/john-ackerman/279530-mexico-amlo-ganar-elecciones-felicidades,03-07-2018,"Los operadores políticos de la corrupción hacían todas las mismas prácticas de antaño: comprando votos, manipulando a los votantes, las llamadas de intimidación, la violencia en las calles y contra los políticos. ¿Pero sabes qué? En esta ocasión, salimos en masa a votar.


Más del 60 % de mexicanos votamos, con colas larguísimas, y logramos inundar y limpiar estas manches del fraude y de la corrupción electoral. Y el domingo en la noche, y los días después, hemos estado celebrando que por fin estamos iniciando esa tan anhelada transición democrática.


Pero ahora viene lo difícil. Tenemos que aprender de esos últimos veinte años de fracasos en la transición democrática del primer intento, para que en este segundo intento no cometamos los mismos errores.


Los pactos de los nuevos gobiernos no pueden ser arriba. Tienen que estar abajo, con el pueblo y con la sociedad. Con la participación de todos, y solamente con esa participación, vamos a poder cambiar a México.


No podemos estar esperando que un solo señor o un partido político nos resuelva los problemas. Tenemos un gran líder. Desde hace décadas, México no ha tenido un presidente de la República con la honestidad, la claridad y la valentía, y el liderazgo y el arraigo popular como Andrés Manuel López Obrador.


Pero no lo podemos dejar solo. Tenemos que acompañar a este nuevo Gobierno críticamente y con nuestra participación. Porque solamente con la colaboración de la sociedad vamos a poder llegar al fondo y resolver de raíz los problemas de México.


El cambio depende de ti y de todos los mexicanos.",RT,John Ackerman
48,"""Los políticos mexicanos andan desesperados: ¡No vendas tu voto!""",https://actualidad.rt.com/opinion/john-ackerman/278180-mexico-elecciones-nieto-vender-voto,26-06-2018,"Si no votas o vendes tu voto, dejas que alguien más decida por ti. No te quedes callado: expresa tu opinión en las urnas este 1 de julio.


Los políticos andan desesperados. Están comprando votos a diestra y siniestra, presionando a los beneficiarios de los programas sociales, intimidando a los votantes por teléfono, generando violencia con sus provocadores y preparando operativos masivos para acarrear votantes el día de la elección.


No soportan que los ciudadanos mandemos ni siquiera un día del año. Quieren evitar a toda costa que hable la voz del pueblo este domingo, 1 de julio.


Es muy importante denunciar cualquier presión o 'incentivo' para votar. En la UNAM te podemos apoyar, por ejemplo. En la página de Diálogos por la democracia hay un formato muy ágil para reportar cualquier irregularidad.


Pero el verdadero antídoto contra el veneno de la corrupción electoral es la participación ciudadana. Cuando las urnas se llenan de alegría, a los maleantes no les queda otra opción que regresar a casa.


No permitas que te roben tu futuro. Con tu voto, puedes decidir quién será el próximo presidente de la República. No es poca cosa. México te necesita.",RT,John Ackerman
49,Guerra sucia,https://actualidad.rt.com/opinion/john-ackerman/276543-guerra-sucia-mexico,18-06-2018,"Ya somos, al parecer, más los mexicanos que hemos recibido las llamadas intimidatorias que los que no las hemos recibido.


Estas acciones violan la ley de cinco maneras:


Primero, implican el mal uso de datos personales, ya que alguien está compartiendo con los 'call centers' nuestros números telefónicos.


Segundo, las llamadas calumnian a Andrés Manuel López Obrador y su partido Morena, al vincularlos falsamente con la delincuencia.


Tercero, significan un enorme gasto electoral privado ilegal, excesivo y no reportado a las autoridades.


Cuarto, las llamadas realizadas desde el extranjero —por ejemplo, Brasil o Grecia— violan la prohibición absoluta en contra del financiamiento electoral internacional.


Finalmente, quien promueve estas llamadas comete un delito, ya que la Ley General en Materia de Delitos Electorales impone una multa de 50 a 100 días y prisión de seis meses a tres años a cualquier persona que ""realice, por cualquier medio, algún acto que provoque temor o intimidación en el electorado"".


El Instituto Nacional Electoral, la Fiscalía Especializada para la Atención de Delitos Electorales y el Instituto Nacional de Protección de Datos Personales dicen que están investigando el tema pero, mientras, no pasa absolutamente nada: continúan las llamadas y todos hacen la vista gorda.


Afortunadamente, los mexicanos ya estamos curados en salud. No es la primera vez que nos agreden con este tipo de guerras sucias.


El miedo se esfuma frente a la enorme ola de esperanza que empieza a inundar a la Nación.",RT,John Ackerman
50,Nestora Salgado no es ninguna delincuente,https://actualidad.rt.com/opinion/john-ackerman/274634-nestora-salgado-luchadora-social-ackerman,06-06-2018,"No se dejen engañar: Nestora Salgado no es ninguna delincuente, sino una valiente luchadora social cuyo único pecado fue defender a su pueblo de los narcotraficantes y los corruptos.


Olinalá es una hermosa comunidad indígena enclavada en la región de La Montaña de Guerrero, conocida históricamente por sus bellas artesanías y su pueblo trabajador, pero décadas de malos gobiernos del PRI y del PRD han desgarrado al tejido social y corrompido la clase política.


Cuando Nestora regresó a su pueblo natal hace unos años, lo encontró destruido por delincuentes y carcomido por narcotraficantes, todos protegidos por las autoridades gubernamentales.


Pero en lugar de huir de regreso hacia el sueño americano que había logrado en los Estados Unidos, Nestora decidió quedarse para luchar, al lado de sus familiares y amigos, a favor de la paz y la justicia.


Nestora Salgado jamás ha cometido delito alguno. Todos los cargos en su contra fueron fabricados por las mismas autoridades delincuenciales que se sintieron amenazadas por sus denuncias. Los supuestos testigos jamás se presentaron a declarar ante el juez y todas las actuaciones de Nestora como comandanta de la Policía Comunitaria se encontraron plenamente amparadas por la Ley 701 del estado de Guerrero, que reconoce plenamente los usos y costumbres de los pueblos indígenas.


La renovada persecución mediática y judicial en contra de Nestora solo evidencia la extrema desesperación de un sistema autoritario que ya se acerca a su fin. Quien tendría que estar en la cárcel no son los valientes luchadores sociales, sino los burócratas y los políticos cómplices de graves crímenes de lesa humanidad y de corruptelas inaceptables.


México hoy está de cabeza, pero llegó la hora para ponerla de pie.",RT,John Ackerman
51,"""Perdamos el miedo para que la democracia mexicana pueda florecer de nuevo""",https://actualidad.rt.com/opinion/john-ackerman/273698-voto-obligado-mexico,30-05-2018,"Empresarios mexicanos indican a sus empleados que no voten por políticos ""populistas"" en las próximas elecciones presidenciales, en clara alusión al izquierdista Andrés Manuel López Obrador.


La ley es muy clara: ninguna empresa tiene el derecho a presionar a sus empleados para votar a favor o en contra de ningún candidato.


De repente, ha surgido un alud de denuncias ciudadanas en contra de dueños y directivos de empresas, que estarían coaccionando a sus empleados para que en las próximas elecciones presidenciales del 1 de julio no voten por Andrés Manuel López Obrador.


Trabajadores de Coppel, Lala, Herdez, Vasconia, Palacio de Hierro, Aeroméxico, Jafra y Pemex —entre otras empresas— han circulado diversas publicaciones, correos electrónicos, ""pláticas informativas"" e, incluso, ofertas económicas que implican una clara violación a la legislación electoral.


Es cierto que la Constitución mexicana garantiza la libertad de expresión. Los ciudadanos tenemos el pleno derecho a expresar nuestros puntos de vista a título personal, en todos los foros públicos y los medios de comunicación. Sin embargo, cuando el dueño o el directivo de una empresa utiliza su poder jerárquico para insinuar a sus empleados cómo deberían votar, ello afecta la libertad del sufragio y constituye un delito electoral.


Es muy importante denunciar estos atropellos. Aunque no confiemos en las autoridades, es nuestra obligación ciudadana documentar y presentar las quejas correspondientes. También, es muy útil exhibir estas malas prácticas en las redes sociales y con los medios de comunicación.


El Estado de derecho es solo posible con la participación de todos. Visibilicemos y hagamos pública cualquier presión que se ejerza sobre los ciudadanos o los votantes. Perdamos el miedo para que nuestra democracia pueda florecer de nuevo.",RT,John Ackerman
52,Donald Trump lo volvió a hacer,https://actualidad.rt.com/opinion/john-ackerman/272676-donald-trump-volvio-hacer,23-05-2018,"Ya había descalificado a los países de origen de los migrantes como ""hoyos de mierda"" y ahora dice que somos ""animales"". El presidente de Estados Unidos, Donald Trump, lo dijo claramente y con todas sus letras. El pasado 16 de mayo, durante una mesa redonda con políticos de California, el mandatario señaló que muchos migrantes ""no son personas"", sino simplemente ""animales"".


Así veían los conquistadores españoles a los pueblos indígenas de América Latina. Así caracterizaban los primeros migrantes europeos en Estados Unidos a los esclavos africanos que importaban para hacer el trabajo duro en sus colonias.


Cuando deshumanizamos al otro, cuando discriminamos en función del color de piel o el origen nacional o étnico de otro grupo social, violamos los principios más básicos de la democracia, los derechos humanos y la civilización.


Lamentablemente, en México también tenemos a nuestros trumpistas. Nunca hay que olvidar cómo Enrique Peña Nieto invitó a Trump a Los Pinos durante su campaña presidencial de 2016, las burlas de Enrique Ochoa sobre los ""prietos"" y de Javier Lozano sobre los ""viejitos"" ni las constantes mentiras y noticias falsas inventadas por Ricardo Anaya: todos son claros ejemplos de que el estilo trumpista, lamentablemente, está vivito y coleando.


Humanicemos la política. Rechacemos la intolerancia y el racismo. México merece más, mucho más.",RT,John Ackerman
53,"""Formemos un enorme ejército de ciudadanos capaz de derrotar al fraude""",https://actualidad.rt.com/opinion/john-ackerman/271749-mexico-elecciones-voto-democracia,16-05-2018,"La democracia es demasiado importante para dejarla en manos de los políticos o de las instituciones electorales. Después de emitir tu sufragio este primero de julio, no regreses a casa, quédate a observar y a defender tu voto.


Las encuestas hablan de un muy probable viraje histórico este próximo 1 de julio. Pero las elecciones no se ganan con sondeos de opinión, sino con votos en las urnas. Y México no es un país democrático.


Las elecciones en Coahuila y el estado de México, así como las presidenciales de 2006 y 2012, han demostrado que el sistema autoritario tiene mil maneras para manipular los resultados y garantizar su continuidad, aun en contra del enorme repudio popular. Y las declaraciones recientes de Lorenzo Córdova, anticipando un margen estrecho en los resultados presidenciales, confirman una vez más la parcialidad de las autoridades electorales.


Afortunadamente, existe una vía ciudadana para defender la democracia. Las autoridades electorales lo han promovido muy poco, porque no les conviene la participación y la vigilancia ciudadanas. Pero la ley permite que los ciudadanos atestigüen directamente el conteo de los votos la noche de la elección. Solo podrás ejercer este derecho si te registras como observador electoral antes del 31 de mayo. El trámite es muy sencillo. Solo llevas dos fotografías y tu credencial de electoral a cualquier oficina del INE.


No es hora de descansar en nuestros laureles, sino de tomar acción a favor de la democracia. Formemos juntos un enorme ejército de ciudadanos observadores capaz de derrotar al fraude y garantizar la soberanía popular.",RT,John Ackerman
54,"""México es hoy uno de los países más desiguales del mundo""",https://actualidad.rt.com/opinion/john-ackerman/271095-mexico-hoy-paises-desiguales-mundo,11-05-2018,"En los últimos años, un pequeño grupo de empresarios se ha hecho inmensamente rico al amparo del poder público. Ya es hora de que haya un verdadero libre mercado en México, en que el esfuerzo, y no los conectes o los amigos, determine el éxito empresarial. 


México es hoy uno de los países más desiguales del mundo. El 1 % más privilegiado recibe el 21 % de los ingresos de la nación. Y el 10 % más rico posee dos terceras partes de toda la riqueza del país. Mientras 16 multimillonarios mexicanos viven literalmente como reyes, más de 50 millones apenas sobreviven bajo la línea de pobreza. 23 millones de mexicanos ni siquiera alcanzan la canasta básica alimentaria. Tener dinero no es pecado y no es necesario expropiarle a nadie. Pero sí es urgente cortar el cordón umbilical entre el Estado y los grandes empresarios para abrir paso a la libre competencia y la democracia.


Carlos Slim, Germán Larrea, Alberto Bailleres, Claudio X. González. Sus enormes fortunas son resultado de sus esfuerzos, sí, pero también de sus amistades y de sus acuerdos no siempre tan pulcros con el poder. ¿No les duele la enorme pobreza en la que viven la mayoría de sus compatriotas? ¿No les indigna que tantos mexicanos no tengan acceso a servicios dignos de salud y de educación, a pesar de trabajar de sol a sombra con el sudor en la frente? ¿No les preocupa los enormes obstáculos que tienen que superar los pequeños y medianos empresarios para tener éxito? Pues, juzgando por sus acciones, por sus chantajes y sus presiones, al parecer lo único que les interesa son sus privilegios y sus prebendas. Les invito a reflexionar y a rectificar. México no les pertenece a ustedes, sino a todas y todos los ciudadanos que habitan este bello territorio nacional.",RT,John Ackerman
55,¿Todos unidos contra AMLO?,https://actualidad.rt.com/opinion/john-ackerman/269606-todos-unidos-amlo,26-04-2018,"En 2006, el PRI apoyó al PAN con el fin de cerrarle el paso a Andrés Manuel López Obrador. Elba Esther Gordillo operó con los gobernadores del PRI para rellenar urnas a favor de Felipe Calderón y Enrique Peña Nieto, entonces gobernador del Estado de México, ayudó a Calderón con más de dos millones de votos.


En 2012, Calderón devolvió el favor a Peña Nieto: dejó morir a Josefina Vázquez Mota y se lanzó con todo el aparato estatal para apoyar al 'príncipe de Atlacomulco'.


Pero en 2018, las cosas se ven mucho más complicadas para el PRIAN. José Antonio Meade y Ricardo Anaya siguen dándose con la cubeta y otros dos políticos del mismo grupo, Margarita Zavala y Jaime Rodríguez Calderón, también lograron colarse a la boleta electoral.


La mafia sigue sin ponerse de acuerdo sobre quién tendría que ser el paladín de la continuidad. Mientras, López Obrador sube y sube y sube como la espuma en las encuestas. Primero, 10 % arriba; después, 18 puntos y ahora, 22 puntos, de acuerdo con la última medición del periódico Reforma.


Todo parece indicar que, aunque de repente Meade, Anaya, Zavala y 'El Bronco' se pusieran de acuerdo para unirse contra AMLO, ya sería demasiado tarde.


¿Será ya imparable la ola obradorista? Observemos y participemos con valentía y ojo crítico.",RT,John Ackerman
56,¿Traman un enorme fraude para el 1 de julio?,https://actualidad.rt.com/opinion/john-ackerman/268932-traman-enorme-fraude-1-julio,18-04-2018,"Todo el mundo reconoce que Jaime Rodríguez Calderón no logró reunir los 866.573 apoyos ciudadanos necesarios para registrar su candidatura presidencial pero la mayoría de los magistrados del Tribunal Electoral decidieron, simplemente, regalarle las firmas que necesitaba.


La decisión no tuvo pies ni cabeza desde un punto de vista jurídico e implica premiar a una persona que, muy probablemente, cometió graves delitos electorales.


""El que no tranza, no avanza"", dicen los magistrados electorales.


Pero lo más grave de este caso no es solo la inclusión ilegal de 'El Bronco' en la boleta electoral, sino que cuatro de los siete magistrados electorales se han evidenciado como jueces de consigna, que prefieren acatar acuerdos corruptos a defender la legalidad.


En la política no hay coincidencias. Unos días antes del fallo sobre 'El Bronco', el expresidente Carlos Salinas de Gortari había reunido a representantes de los tres poderes del Estado mexicano —el Ejecutivo, el Legislativo y el Judicial— y de los dos partidos del poder, el PRI y el PAN, en una ostentosa fiesta para celebrar sus 70 años.


¿Qué más estarán tramando estos mafiosos? ¿Estarán también planeado cometer un enorme fraude electoral en las próximas elecciones presidenciales?


Pues, que escuchen bien el siguiente mensaje: Ustedes tendrán mucho dinero y poder pero, al final de cuentas, son muy pocos.


De este lado, de la ciudadanía indignada y organizada, somos más, muchos más, y esta vez no se saldrán con la suya.


Te lo garantizo y te lo firmo.",RT,John Ackerman
57,"Amenazas, presiones y chantajes de Washington",https://actualidad.rt.com/opinion/john-ackerman/268163-amenazas-presiones-chantajes-whashington,11-04-2018,"No se dejen engañar. El problema no es Donald Trump, sino Enrique Peña Nieto. Las amenazas, las presiones y los chantajes de Washington solo surten efecto cuando los mexicanos agachamos la cabeza y obedecemos en silencio.


Hace unos días, Donald Trump ordenó al Gobierno mexicano frenar el 'viacrucis del migrante', una procesión pacífica que se celebra cada año con el fin de evidenciar los sufrimientos de los migrantes centroamericanos y exigir un cambio radical en las políticas antimigratorias tanto de México como de los Estados Unidos. Trump dijo que cancelaría el Tratado de Libre Comercio y suspendería todo apoyo al Gobierno mexicano si Videgaray y Peña Nieto no dispersaban inmediatamente la caravana. Dicho y hecho. Como viles sirvientes del imperio, los gobernantes mexicanos siguieron al pie de la letra las órdenes de Washington.


Pero esto no es todo. El siguiente día, el miércoles 4 de abril, Trump ordenó la militarización de la frontera con México con la movilización de miles de integrantes de la Guardia Nacional. ¿Y qué respondieron el presidente de México y su canciller? Con puras palabras huecas, demagogia y patrioterismo. Peña Nieto transmitió un mensaje en cadena nacional en que, supuestamente muy indignado, termina por ponerse una vez más a las órdenes del señor Trump.


Ha llegado la hora de pasar de los discursos a la acción. Frente al pasmo del presidente, el Senado de la República y toda la sociedad mexicana deben actuar. Ya no podemos seguir aguantando en silencio y con la cabeza agachada tanto abuso y maltrato. Que se escuche la voz, pacífica pero firme, de la dignidad y la soberanía mexicanas.",RT,John Ackerman
58,¿Qué hacer con el nuevo aeropuerto de la Ciudad de México?,https://actualidad.rt.com/opinion/john-ackerman/267504-uso-dinero-publico-mexico,04-04-2018,"Existen serios cuestionamientos con respecto al nuevo aeropuerto de Enrique Peña Nieto.


En primer lugar, su construcción requeriría el cierre de las pistas del aeropuerto actual, tirando por la borda los 8.595 millones de pesos utilizados para construir la nueva terminal 2.


Segundo: un lago no es exactamente un lugar ideal para colocar un aeropuerto. El suelo es débil y se hunde constantemente. Requiere de una enorme inversión para habilitar las pistas y, después, para mantenerlas.


Tercero: existen serias preocupaciones ambientales, ya que el proyecto pone en riesgo la vida de 120.000 aves y podría generar una crisis de abastecimiento de agua en la región.


Cuarto: hay claros indicios de corrupción en los contratos del nuevo aeropuerto. El presupuesto inicial fue de 169.000 millones de pesos, pero ahora se habla de hasta 250.000 millones… y eso que apenas inician las obras. Solamente para la construcción de la barda perimetral, por ejemplo, el precio ya se disparó un 89 % por medio de cuatro convenios modificatorios. El 70 % de los contratos del nuevo aeropuerto se realizaron por medio de adjudicaciones directas; es decir, sin las licitaciones públicas que dan transparencia a estos procesos. ¡Y sorpresa! Quienes hoy cuentan con contratos son los empresarios y oligarcas más poderosos del país, como Carlos Slim, Olegario Vázquez Aldir y Carlos Hank Rhon.


Y, para rematar, el Gobierno ahora hipoteca nuestras propias pensiones para seguir alimentando el monstruo de la corrupción. Acaban de enviar más de 13.000 millones de pesos de las Afores para financiar las próximas obras del aeropuerto.


Ya hemos vivido la experiencia de obras faraónicas fallidas y corruptas. Con Felipe Calderón, por ejemplo, el precio de Estela de Luz se disparó cuatro veces más de lo originalmente presupuestado: de 393 millones a 1.312 millones de pesos.


El dinero público no debería utilizarse para el lucimiento del Gobierno en turno, sino para atender las necesidades de los ciudadanos.


Revisemos el proyecto del nuevo aeropuerto, veamos qué otras opciones existen y avancemos con paso firme. ¿O qué opinas tú?",RT,John Ackerman
